{
  "$schema": "../../../v1/execution/sweep_manifest.schema.json",
  "schema_version": "1.0",
  "sweep_id": "test_sweep_001",
  "base_config": {
    "schema_version": "1.0",
    "experiment_id": "test_exp_baseline",
    "state_type": "GHZ",
    "n_qubits": 3,
    "shots": 1024,
    "engine_config_hash": "sha256:abc123def456",
    "research": {
      "phase": "threshold_mapping"
    }
  },
  "parameter_ranges": {
    "error_rate": [0.01, 0.02, 0.05]
  },
  "runs_per_config": 3,
  "seed_strategy": "fixed_increment",
  "provenance": {
    "schema_version": "1.0",
    "engine_config_hash": "sha256:abc123def456",
    "execution_backend": "qasm_simulator",
    "timestamp": "2025-08-16T12:00:00Z"
  }
}